review_number,review_text
review1,"I purchased this unit to prepare for the hurricane season in Florida. Although I haven’t had a chance to use it during an outage, I have been using it extensively over the past week to test its reliability in keeping the household functioning smoothly. Here’s a detailed account of how I utilized this powerhouse: I set up the Explorer 1000 v2 in a central location within my home for easy access. The first priority was to connect the refrigerator to prevent food spoilage. The 1500W AC output was more than sufficient to keep it running without any hiccups. I also connected a portable air conditioning unit to test it, as outages often happen during particularly hot spells. The power station handled both appliances simultaneously, and I am satisfied with the results. With the power station’s multiple charging ports, I was able to keep all our essential communication devices powered. I used the 100W PD USB-C ports to quickly charge smartphones and a tablet. The fast charging ensured our phones were ready to use much quicker than standard chargers, keeping us connected to family and emergency services. Throughout the testing, I actively used the Jackery app to monitor the power station’s battery level and manage its output. The app allowed me to switch between charging modes depending on our power needs, which may be helpful in prolonging battery life over several hours of an outage. At night, utilizing the quiet mode was beneficial. It significantly reduced the noise level, allowing my family and me to sleep without disturbance while still powering our fridge and a few fans throughout the night. I also have a gas generator at home, and using the Explorer 1000 v2 is a totally different experience. The absence of generator noise makes you forget the fact that you are using backup power. As for the charging speed, Jackery claims a one-hour recharge feature for the Explorer 1000 v2 when the emergency charging mode is activated in the app. While the one-hour recharge is convenient and charges quickly as advertised, it reverts to normal charging mode after each quick charge. So, I just stick with the normal charging mode most of the time. It takes about 1 hour and 40 minutes to recharge the 1000 v2 from 0 to 100%, which is good enough for me. Overall, the Explorer 1000 v2 can be trusted as a backup power source during outages. It’s a versatile, powerful tool that will keep our household safe and comfortable."
review2,"To start with, I love my Jackery Explorer 300 and took a chance on the Explorer 1000 and not disappointed. This is copy of my review for DJI Portable Power Station 1000 Vs the Jackery Explorer 1000. I hope to help others when comparing these two popular power stations that are both known for reliability. In the end for a quick read, the Jackery Explorer out performed the DJI Portable Power Station by quite a bit. Great job Jackery! Here is my slightly edited review: I purchased the DJI Power 1,000 Portable Power Station for emegencies as well as camping and such. I do own a Jackery Explorer 300 as well as a Jackery Exporer 1000. Today I tested the Jackery Explorer 1000 (1500W rating) as well as the DJI Power 1000 (2200W rating). I've had the Jackery 1000 for maybe a month and the DJI for about 1 week and both were new up to today and charged to 100% for the first time for this test. I connected each to a 1000W heater (Presto Heat Dish) which is a reflective type heater with no fan/blower, just a heating element reflected off what looks like a satellite dish. I put the heater at highest setting and it was rated at about 1045-1047 watt output according to both battery power stations. I tried to run them both for ONE hour and see what percentage of the battery power stations was left after the hour. The Jackery Exporer 1000 had 40% battery life after 1 one hour which was good, so I first thought. After trying the DJI 1000, the Jackery was apparently very good. The Jackery never really got too warm and was super quiet. The DJI Power 1000 could not make it to one hour. I shut it down after 45 minutes as it only had 7% battery life left. I never run them to zero and 7% was much lower than I like to run them to, but wanted to milk this until at least 45 minutes, which I did. The fan area near the power switch area of the DJI was pretty warm and the other side fan area was cool, near the outlets. The DJI also had noticeable fan noise, but it was just noticeable and not loud. I also noticed after getting the DJI Power 1000 that it didn't have the cigarette lighter receptacle (12V DC) like the Jackery did, which I overlooked. The Jackery is about 2/3 the weight of the DJI and has a swing handle across the top like most smaller power stations do. The DJI had two fixed grips, one on each side which seem more sturdy, but not as convenient to carry around. I don't usually rate and review two named items in a review but both are great names with reliabilty and known quality. I'm just sad to say that the DJI did not live up to my expectations and relly disappointed. Hopefully they will get the battery management taken care of in future models. With the DJI rated another 700 watts than the Jackery, I guess I expected more. If I were to put a 2200 watt device on the DJI Power 1000, I'm not sure it would last a half hour. I would recommend the Jackery Exporer 1000 very easily after my test. jackery is quiet, reliable and the energy used is very well managed within the system."
review3,"This is an amazingly useful gadget! Ours is charged and awaiting the next power outage, but meanwhile it replaces my 2000-watt generator for most jobs. For example: it runs my electric chainsaw just fine. It’s not as heavy as my gas generator, it’s quiet, and totally fuss and drama free!"
review4,"Good portable power for many uses. Quick charging, solar panel option. We found that fully charged, it would power two CPAP machines overnight for two nights. Would probably keep your refrigerator running for 18 hours or so, depending on the size of the fridge and whether or not you're opening it much. We also bought the larger size when Amazon had them on sale at the Black Friday event. Highly recommended and Jackery has a great reputation for producing quality portable power devices."
review5,"This was on sale at an amazing price for Black Friday, so I blew my meager budget and bought it. The package arrived yesterday and I opened the box and hooked it up to house power to get it charged up before my Christmas camping trip. As with my 3 other smaller Jackeries, the quality workmanship is evident. The weight is definitely heavy, but not too heavy for me to pick it up and carry it a short distance. Unlike my older Jackeries, the handle on this model folds up to carry and down flat to store. It arrived with 28% charge, so I plugged it in as soon as I had it unboxed. It charged fairly quickly and the display screen tells me the wattage of the charge and it also shows the percent charge. It came with a heavy duty ""Jackery Orange"" AC power cable. I was sad to see that it did NOT come with a cigarette lighter charge cable. And to increase my sadness, I also discovered that it did not come with the solar charge cable; so I had to rush to Amazon and find those items. I had to order two ""7909 to 8020 plugs"" to hook up to my solar charge cables that I already had for my 290w Jackery batteries. Twenty bucks for those; one arriving today the other arriving tomorrow. And I ordered a cigarette lighter charge cable for another 18 dollars that should arrive today. None of those items were Jackery products. I wish Jackery would have included all these accessories with the battery. I'm hoping all the items arrive here in time for my trip. Anyway, I'm a Jackery fan and this is a big, powerful, well made, quality battery. Even without the needed accessories."
review6,"I am an Electronics Engineer and purchased this generator for backup power. This generator is fantastic with a great design ,it is small and not to heavy, has a nice front panel to see charge level, load and input power. I am also a Amateur Radio operator and have used this to power my station in the event of a power outage. My station draws 100- 800 watts depending on transmitted output and it ran this for over 5 hours with 15% charge left. When first received it had a 30% charge and plugged into AC and it charged up in a couple of hours to 100%. I ran an 1800 watt heater and it held the load without any trouble. Of course it would not last to long due to the over rating of the load . I used the 200 watt solar panel to charge the unit and with two partly cloudy days it took about 4- 5 hours each day to be fully charged. with full sun this would be faster. The solar panel works well but you have to move it periodically to maximize solar input and it has a small sight glass to be sure you are aligned with the sun angle. I am very pleased with this generator and will most likely get another so that I will have 400 watts of solar going into the generator (it has two 24volt charge inputs). I did not try charging from my car 12 volt dc . I need to get a cable, though dc chargers are often limited to 10 Amp charge current so the charging could take a while. Overall great unit with versatile charging options( reason I purchased) Have a few of these around and you will have a portable decentralized, quiet power source."
review7,"I bought this portable generator in case of a blackout, so far so good... it is a portable Generator that runs off of solar power. I haven't had a chance to really see how it works. But I have noticed it is a heavy duty, long lasting quality item, that would automatically go to work when pluged in."
review8,"Best purchase I’ve ever made. I’m staying off grid right now in rural New Mexico and this thing is a lifesaver. I purchased a third-party solar panel to go with it because the one made by Jackery is triple the price. So far, after four months, it’s charged just fine with the different panel. My only complaint about this generator is that you have to download an app to use some of its functions. Doesn’t that defeat the purpose of being off-grid where there is likely no cell signal? I don’t know who made that decision but it wasn’t a logical one. Other than that, this thing works like a charm and lasts for nearly a week, as long as I’m using it for things that don’t involve tons of heat."
review9,"I love this thing. It has great flexibility and power. So far I only have 2 small gripes. First, the plugs that jackery uses for solar panels is kind of unique. The solar panels I bought were ""standard"", highly rated, and came with 10 different plug types. None of those plugs worked with the jackery and apparently this is pretty common, having to buy another adapter plug just for jackery devices. So a more common plug standard would be nice. The second gripe is that the AC input power requirements are strict enough that I couldn't charge the jackery with my car using a 300w inverter. The jackery would come to life for about 2 seconds trying to charge, then would stop charging. It would cycle on/off continuously trying to charge from the 300w inverter. It would be nice if the jackery charging circuitry could handle charging from a ""weak"" AC source since available AC power isn't always clean. That's why we have the jackery in the first place! So not being able to charge even slowly from a slightly weak AC source is a big drawback. Other than these gripes however, I am really liking the jackery. Recommended!"
review10,"I love how this thing is set up so intuitively. I feel that if I was away from home and the power went out my `non-technical' wife would know how to connect it to the solar panel, aim it at the sun, monitor the input and output wattage on its simple center gauge, and run what appliances/devices she needs. We bought it as a peace of mind. My attention to even considering a solar generator (an overly fancy name for a battery pack) came up while seeing the brand (begins with a ""P"") that heavily runs TV commercials. But, theirs is several hundred dollars more than this Jackery model, and their solar panel generates 100 watts with this one generating 200 watts; and, theirs boasts 1200 watts of functional power wattage, and this Jackery has 1500 watts. The Jackery is also 2 lbs lighter (24 vs. theirs at 26 lbs.). It seems that Jackery incorporated several updates and improvements into this second generation model based on the YouTube reviews I watched. Overall, in my opinion this is a better than average..... solar battery pack. and, I hope to God we never need it, though if my wife and I ever start camping again, now that our kids are on their own, this thing will be central to our packed items."
review11,"I’m not going to go over specs since it’s well known. Just the good and the bad. I took measurements of the AC and DC power outlets and here’s what I found. Pictures show that 2 similarly rated solar panels are charging at 205 watts, which means the built in MPPT charge regulator is working effectively. The AC power is probably better than the quality of your home AC outlets served by your utility company. The sine wave is pretty much perfect without artifacts as seen on my oscilloscope. The frequency is a rock solid 60 Hz with a rock solid 120 volt AC output on most loads. That’s refreshing because some of these so called solar generators put out lower voltage. The DC cigar outlet puts out 13 volts which is adequate, but would have liked to have seen 13.8 volts which would be standard for automotive accessories and radio gear like Ham equipment which likes a solid 13.8 volts in some cases. Fan noise is much better than other brands with similar specs. Probably because they are using a larger fan at lower speeds to cool the inverter power supply. Overall I am very happy with the fit and finish, including the new fold down handle and flat square top. The only complaints I have are as follows: Jackery really skimped out on the USB ports, giving you only one USB A which is ridiculous, and two USB C ports which is just okay. They could have easily doubled that for whatever it costs to make it into a better, more convenient charging station. As I mentioned above, it would have been better to have the DC car charger port put out a more standard 13.8 volts DC. Lastly, it would have been much more practical to include an Anderson Type DC outlet for powering DC equipment at up to 20 Amps instead of the antiquated cigar outlet that can only handle 10 Amps or about 120 watts which is very limited for higher power consumption equipment such as radio equipment, etc. I love the fact that Jackery is finally moving to LiFePO4 battery chemistry which allows for up to 4000 charge cycles (to 70% of original capacity) as per the manufacture specifications. That’s a little optimistic, but it’s much better than some other Lithium ion technology that specifies around 500 cycles. I also love the very fast charging at 1000 watts with a 1200 watt option for super fast charging. The charger is conveniently built in to the unit, so no more power supply bricks to carry around, or worse, to forget at home. The users manual isn’t great, and the “Battery Saver” mode isn’t clearly explained, but it’s a fantastic way to dramatically increase the overall service life of your Jackery by limiting your charge to 85% and limiting discharging to the 15% level. You can change this to get 100% of your battery capacity when needed, but at the expense of overall number of charge cycles. This puts you in control, and is a very welcome and useful feature. I highly recommend this model E1000 V2 by Jackery. It’s all most people will need."
review12,This was a lifesaver as it arrived 3 days before the hurricane and kept my freezer full of steaks going for a few days. Last storm I had to throw hundreds of dollars of food away. It is easy to use and when I put it on sliders it was easy for this old woman to move from place to place with the handle. My only complaint is the price. It went down a couple of days after I purchased it and Amazon could not give me a rebate and neither would Jackery. I ended up buying a second one for $100 less a couple of months later so I would have a longer safety net for the next storm. The price variations are the biggest downfall and would be behoove those wanting to buy to keep track and buy accordingly. I picked this brand because of all the live in your van and tiny home videos I watch on YouTube. You have to top it off every 3 months but so far mine have remained at 100% capacity. I hope I seldom or never need to use them. That would not be wasted money but a sort of insurance. The winter I bought a new coat and boots it did not snow and I was tempted to do the same the next year. Cheaper than heat bills.
review13,"Many of you are probably like me having a tough time deciding between Delta 2 or Explorer 1000v2. The 2 are almost identical in all aspects. Both Ecoflow and Jackery are good brands, and you can expect good build quality and reliability. Seems that the Explorer is always priced at $50 below the Delta 2. At the end, I picked the Explorer. The rationale was simple. I could not find any justification to spend $50 more for the Delta 2. On Black Friday, net price for Explorer was $349, which was a no brainer. For reference I paid $400 for the Ecoflow River 2 Pro 8 months ago. I use these power stations primarily during power outage. If you run them 24/7, your buying decision may be different. Expandability is not a factor for me (the add-on batteries are never cheap anyway), nor is solar charging. I deploy the power stations distributively wherever power is needed, rather than building them into a centralized power source. Here are the main differences between the Explorer and the Delta 2 that I considered. - The Explorer is $50 cheaper ($349 vs $399 on Black Friday) - The Explorer has a good LED lamp which is handy during power outage. - The Explorer has bigger capacity (1070Wh vs 1024) - The Explorer is 3 lbs lighter. To me, anything over 25lb is only marginally portable. - The Explorer does lack 12vdc barrel plug ports which Ecoflow has. Those ports can be used to power modems. But I already have other power stations that have those ports. - The solar port on the Explorer not as common as that on the Delta 2. - The ac sockets are upfront on Explorer while in the back for Delta. I prefer them to be upfront. I see absolutely no advantage of them being in the back, except maybe it looks neater to have the cables in the back if you have a semi-permanent installation. Definitely better to have them upfront for emergency use. On charging. When I first got my Explorer, it was 80% charged. And it seemed stuck at a very slow charging rate of about 300W. Installing the mobile app and selecting the ""emergency boost mode"" made no difference while selecting the slower quiet mode actually made it charge faster. I thought I had a defective unit for sure. But after draining the battery, the battery then charged between 600 to 800W most of the time at the default fast mode until near the top-off stage. Hitting the boost mode did take it up to 1000W level. Even quiet mode got over 300W. I am convinced that the unit can be fully charged using the default fast mode in well under 2 hours, and that is good enough for me. Even at the default fast mode, it was much quieter than my Ecoflow River 2 pro. The quiet mode does bring down the noise to an unobtrusive level. The inverter on the Explorer seems excellent. The ac output was very steady at 120V, never dropping below 119V on 100W draw."
review14,"Wondering about the actual wattage of the solar panels? Verified 200w! I live in New England and figured I'd only get 200w out in the desert at mid day. I just put them in my backyard, not even properly aligned, and got 193w input to the battery. Charged from 93% to 100% in about half an hour. This was the biggest concern I had because solar is so environmentally dependent. The battery itself is fantastic. The USB-C 100w is perfect for my laptop without having to convert through the AC. 3 AC outlets is plenty for me. Lots of info on the battery itself and through the app. Well designed and well made. Very happy."
review15,"I can unironically attest that the Jackery Explorer 1000 V2 is a game changer because I am not confined to a household outlet when I have an outdoor project. I can use my 10-gallon shop vac and carpet spot cleaner to clean my car anywhere. I have a Mora fridge with a 22.3 Cu. Ft. bottom freezer, and the Jackery can keep it powered for 18 hours. The runtime goes down to about 8-10 hours when I plug in the fridge and my 7.0 Cu. Ft. Insignia Chest Freezer at the same time. I have also used it to run my office set up, which includes an internet router, lamp, monitor, and laptop for 12-14 hours. I got this when it went on sale on Black Friday 2024 for $450 (before tax), and bought a second one (04.09.25) when it went on sale again for the same price. After researching competitors, no other solar generator can offer you the same capacity and runtime at $450. But if this thing goes back to the regular price? Then you should explore other options. The Jackery Explorer V2 is as big as a large insulated lunchbox and weighs 20 lbs., so it is easy to travel with for outdoor adventures."
review16,"I now have a Jackery 300, 500 and 1000 v.2. I rec'd the 1000 v.2 today. It shipped with 28% power, and I was surprised to see that it came with a direct plug-in power cord (no brick). It took about 75 minutes to charge it, with the input wattage scaling from 300 to 600 watts. After it was fully charged I tested it with our full-size kitchen fridge. When plugged in it initially drew about 250 watts (compressor start?) then settled it at 60 watts per hour. It estimated it would run around 13 hours. When the door was opened and the light came on it spiked to 72 watts. This what I was looking for, something easy to charge and store but that would get us over a 24-48 hour power outage. I'm too old to start my gas generator but this is easily manageable. It does have 2 DC power ports that would take 2 solar panels. All in all, the Jackery family works for me in a number of applications. One solar panel works with all 3."
review17,"Original review below this. Jackery customer support did get a new unit back to me, arguably later than they advertised, however they did outreach to me about my experience, which I appreciate. I have these ordered under a separate account for work, the smaller units for inspectors and they have worked flawlessly to keep laptops and starlink powered in remote areas. I'm going to chalk up the delayed customer service based upon the holidays. When you put out thousands upon thousands of these products, it's not unusual to have a certain percentage fail for various reasons. Jackery is the premier provider of this type product, so part of the purchase is customer service knowing they are going to be around if something goes wrong with your unit. Personally I was unlucky on this particular unit as it died after 6 months for no reason I wasn't even using it. But with that said these things happen and so long as they are backing the warranty all good. All the other units that we purchased for work, they are all going strong. And my older jackery 500 still working great. The main reason I have these is for resiliency especially around wildfires, and power outages in Northern California. While I have a couple of inverter generators that will run 8 hours on a gallon of gas, they are a pain to take out during a three or four hour outage. The products offered by jackery can be a great tool in combination with regular generators. You can bring them inside your house and not worry about carbon monoxide poisoning or anything else. Original review I’ve been a loyal customer of Jackery for years, but my recent experience with the Jackery 1000 V2 and their customer service has left me extremely disappointed. The unit failed within six months with an error fault. I contacted customer service on November 19th, returned the unit before Thanksgiving, and was assured that a replacement would be shipped within two business days. It is now December 6th, and despite numerous follow-ups, I’ve only received vague responses that they are ""looking into it."" This is particularly disheartening given my history with Jackery. My first purchase, a Jackery 500, failed within a week of use about four years ago, but their customer service back then was outstanding. They promptly replaced the unit, which has worked flawlessly ever since. I’ve also purchased several units for work based on my prior positive experiences. I understand that occasional product failures happen—that’s not my issue. What I take issue with is the clear decline in both product reliability and customer service. Jackery's customer service was once a defining feature of the brand, but that no longer seems to be the case. If you’re considering a Jackery product, I recommend looking into alternative brands. While they were once a standout, my recent experience suggests their quality and service have significantly degraded."
