review_number,review_text
review18,"Battery charges fast and worked well. The app has some issues. It won't reliably reconnect to the battery with Bluetooth. The app will not allow me to connect the battery to my WiFi, because the app won't allow spaces in WiFi passwords. Edit: Jackery reached out to help make sure my battery is operating properly. They clarified that the Bluetooth is only active on the battery when it's powered on. I'll be keeping an eye on it to make sure it's staying connected like it's supposed to. They submitted a bug report internally for the app, as it's only an issue right now with the Android version. Hopefully this will be getting fixed soon. I appreciate and admire their support of their product. Thank you Brian!"
review19,"The intuitive and very easy to use phone app should be a model for all hardware apps. The app keeps track of input and output wattage. It allows setting of many parameters including charging rate, auto-off time and emergency charging. The emergency charging mode allows for quick charging in anticipation of an incipient power outage. I have purchased 3 Jackery Explorer 1000's. Hardware is very solid and has a quality feel."
review20,We loved it so much we bought two! Need to be hurricane ready so we wanted to add to our current gas generator. Bought the Jackery and tested it out. Charged fast. Ran our fridge for 7 hours! We also bought the solar panels with our second Jackery. Tried them out and they charged it in just a few hours! We are ready (but hopefully never need them) lol. This company is fantastic to work with!
review21,The Jackery 1000 v2.0 is one of the most awesome products I have ever purchased. After testing it out I feel so much better having one. I'm going to use it for power outages so I can run an IcyBreeze cooler and watch Netflix on my laptop. This is a huge improvement for me since last year's hurricane season.
review22,"The Jackery came but no solar panels. If the solar panel comes still the rating will change. Fast forward... the solar panels came. I had to look at it again because it looks like the stretchy legs are on the front, but from all the videos I've looked at, it's supposed to be that way."
review23,"Quality-built backup battery for power outages. Also great for outside work, saving the hassle with long extension cords. Not to forget the excellent customer service."
review24,This is one of 2 units I bought that are Jackery and works great the 2nd unit is defective and I can’t get it returned keep getting the run around I wanted to buy another one of these units but won’t now if this is how trying to return a defective one is so beware!! I wish I could say better I don’t like leaving bad reviews and I really wanted to buy another unit but not now
review25,"At this point, I have to begin my review from the start, again. The Jackery Explorer 1000v2 is a great looking power station (not a ""generator"" as written on the outer box) which sports multiple 110VAC outlets with a 1500 watt rating, multiple USB 5V options, and a 6V car accessory type outlet. It has two charge inputs which allow up to 400W of charging ability. The battery capacity is 1070Wh though that needs to be taken with reservation since there are several losses not included that can reduce this figure somewhat. The unit is well built with a swing up carrying handle, the Jackery black and orange color scheme, and a squarish profile with rounded corners and edges. It weighs in at 24 pounds or 10.8kg. Included are a 110VAC charging cable (which is the fastest way to charge the unit) and a user manual. Now for my ""cons"". When I tried to load the ""Jackery"" app on my Motorola (Moto g Pure) phone, all the Google Play store would show was a ""Jackery Home"" app. That isn't the correct app (which I found out after loading it and not being able to use it). My phone failed to show the correct app which is the ""Jackery"" app. After finding it with a separate search, I found that my phone wouldn't accept it (I later discovered this is a fault of my phone). I had several discussions with Jackery which didn't lead to anything. I then tried my tablet and it brought up and loaded the ""Jackery"" app with no issues and that is the way I'll have to handle my Bluetooth and WiFi which is ok but I'd rather my phone was capable of that (minus points for Motorola). The thing I was really impressed with was a technician from Jackery had read my comments here and with Jackery support, and called me back and tried to help me get the app working with my phone. Most companies would not have taken that much effort. Kudos to Jackery. One thing missing that probably should have been included with the Jackery Explorer is a solar charge cable and dust caps for the outlets. I will be doing some solar charging and it would have been nice not to have to buy the solar charge cable separately. A nice 6V outlet dust cap came with my smaller Jackery but this one just has the bare outlet which can collect debris pretty easily. This was no big issue since I 3D printed a dust plug which works fine (and I purchased some 110VAC safety plugs for the 110VAC outlets which I painted Jackery orange to match the unit color scheme). All considered, this is a great mid-size power station utilizing Lithium Iron Phosphate cells, which provides a safer, longer lasting power source compared to Lithium Polymer based stations. It's charge capacity and 110VAC output can run lights for a long time, and many common appliances for less time. Heavy loads (my air compressor and vacuum cleaner with power head) are not supported which wasn't too surprising."
review26,"I've had the Explorer 880 (which is essentially a V1 1000 with less watt hours) for a couple of years and while it has performed dutifully during that time and was a literal life saver, it had limitations that I think the 1000 V2 addresses: 1. The V2 inverter outputs 120V instead of the 110V of the V1. It may not matter much for electronics that have their own power supplies but I think it did make a difference for motors and compressors that run just a little more sluggishly. If a house's power is below 114V, it's considered too low by the NEC too. 2. The V2 has 1500 watt sustained output vs. 1000W that the old version had but more importantly, It can go as high as 3000 watts for startup which is absolutely amazing for things like fridges or other devices that have a inrush current. I remember trying a 10 LPM Oxygen concentrator for a now dearly departed family member and the old one would really struggle to start up. Same for fridges. The V2 just doesn't care. 3. The LIFEPO4 battery means a lot more charge cycles so this thing should last a long time...I mean truthfully, plain old Lithium ion should be good for most people too and I've only probably had 6 complete discharge/charge cycles on mine but if you use this for your primary source of power, then it would really matter. 4. This is very simplified with just a power cord and no power brick required. You don't need to remember to take all the attachments with you. I do wish however that they gave the adapter for 8080 DC port so you can use your old car charger instead of buying a new one but you should be able to find on on here for $10. Overall I'm happy with the purchase and wish I had gotten a 2nd one for Black Friday"
review27,Takes 6 hours to charge now they have gens that take 1 hour to charge
review28,Jackery customer service heard about the issue and resolved it. I must change my review to Jackery actually listens and cares about their customers. Says alot since most companies just don't care. Very impressed
review29,"Update: recently reviewed this as not working. I receive connector adaptors from the manufacturer and it now works. I have yet to test it to see if it will handle 1500 watts, that's why I'm saving the last star. I will update this review once I've confirmed that it can handle 1500 watts or close to that number."
review30,I love my two Jackery’s. They are there when you need them. Charges last long. Not bad for recharging. I never let mine get below half. Charging panels are nice. Weight isn’t too bad. They seem to be quality built. I have a very big Dometic refrigerator/freezer for my vehicle and it runs 24/7. I switch them out daily. I love the size of them too. My first one the handle doesn’t fold down so I appreciate that on the new one.
review31,"Update: Jackery customer service promptly reached out to me and provided quick easy reset instructions. My 1000v2 fully charged to 100% and is working flawlessly! Thank you for the prompt attention!! I now have three Jackery units (1000, 300, and 240) and I highly recommend each unit. Received the Jackery 1000. After reading the instructions I checked the unit, it was charged at 28% so I plugged it into to recharge. After charging for 3 hours, it is stuck at 46% (with 0% input indicator). Yes, the outlet works fine. There’s nothing in the instructions addressing this issue so I’m assuming it’s defective. I have not tried the solar panel as it is currently cloudy/raining. Really disappointed since this is my 2nd Jackery purchase. My previous purchase (Jackery 240) was flawless and still works great."
review32,"I have purchased two of these products for our family. A smaller one for camping and traveling and a larger one for emergencies. In fact, we used our larger one in January when the winds caused electrical outage. It kept the refrigerator running all night. We are saving to buy an even larger one for the freezer. Excellent product!"
review33,Works great! The same as my other 3 Jackery's. I trust this brand so I buy only this brand products!
review34,"I love all the Jackrey products. I own several of them. Very versatile when the power goes out to have more than one. I can put one on the freezer, and set up most of the house on an 1800 W unit. And I have a 3000 W Unit that I use is my backup to recharge these if solar doesn’t work. But if the sun is shining the solar works really well. I got this one on an amazing black Friday deal. It’s very nice. If I had known how nice it was, and that it was the updated 1000 W unit I would’ve bought several of them. Unfortunately, that was a one time deal and they’re quite a bit more expensive now."
review35,"This one is a lot better than the one they made before because they handle lays flat. I put the previous one on top. Also, it has Bluetooth so you can turn it on with your phone. If you're in a place where you need to have power because there are blackouts this is the one to have.. I can run my TV with my Internet, which is connected to another backup powder supply for a day."
review36,Used this for fourteen days straight recently on a cart to power different electronic gear on a cart in a hospital and it performed perfectly. I used both the 110v AC USB-C plugs constant draw for 12 or so hours each day and plugged it in each night to re-charge. A great purchase (especially at a discount for cyber Monday).
review37,Outstanding
review38,"I got this power station to run my fridge in the event of a power outage. For reference, my fridge is a cheap, basic GE model that uses about 130 watts while the compressor is running, spikes to 430 watts during startup, and averages 65 watts over the course of a day. This Jackery can run my fridge for a bit over 12 hours, which is about what I expected if you assume the inverter is 80% efficient. I'm sure if I was using a more efficient chest freezer I'd get a lot longer runtime, but that's nothing the generator can control. The jackery does its job well & handles all of the load spikes that come with the compressor spinning up every so often, though admittedly 430 watt peaks are nowhere near the rated 1500w max for this thing. I have a few other (smaller) Jackery power stations, and I've also tested a few other off-brand power stations too. This one has the same sort of quality you can expect from Jackery, and I definitely recommend going with them over some of the other no-name brands. You can pretty much always expect Jackery to meet or exceed it's rated specs, while you can't say the same for some of the cheaper brands... Also, as an aside, their support is great! I missed a promo by buying at the wrong time, and even though Amazon said they couldn't do anything, Jackery's support was able to take care of me. They are definitely my go-to power station brand and I highly recommend them."
review39,"Fairly nice power bank with decent output. One thing I didn't like is that if you apply power to charge, it turns on and doesn't seem to turn off automatically even with zero load. I waited several hours and it was still on draining the battery. It would be nice to plug it into a smart power plug so I can have it charge every month or two, but that's going to be a pain. The cheap monoprice one I got doesn't have this problem."
review40,"Really nice product, good quality build. Saw the price dropped by $50 one week after I bought it. Kindly requested a price adjustment, which they granted within a couple business days."
review41,"Works great! Totally silent, can use indoors because it does not generate carbon monoxide. Thrilled to not have to use that noisy gas generator anymore"
review42,Generator is nice but I had to charge it up inside my house using wall socket . I was not aware that the adapter needed to be removed . Great Product. I will upgrade soon!!! Thank You Jackery Team.
review43,"I like the look and portability. Also, the interface is very easy to use and gives all the pertinent information. The displayed values for time left to charge and to discharge are relatively accurate. But it will be limited as a back-up in a power outage. I tested 3 of my appliances. The freezer at a steady 115W lasted 8.5 hours The refrigerator ranged from 0 to 138W and lasted about 11 hours. The time left to charge varied with the variable wattage used. The space heater, on the medium setting, used 916W and lasted 1 hour. The solar charging gained 1% of charge in about 6 hours of PNW sunshine, so not helpful."
review44,Love this Jackery. My apologies to to the manufacturer for writing a negative review on the app. I downloaded the wrong one and could not connect to the device but after I got the right app. Everything was perfect. After charging it to 100% I ran my Nespresso machine which uses about 1350 watts and the Jachery performance was flawless. Now I am a happy camper with the jackery and the Nespresso machine.
review45,Bluetooth worked upon startup w my iPhone however within a few hours it stopped connecting. Couldn’t get it to hook back up. Will call customer support I figured out Bluetooth. Working proper
review46,"I bought this 40lb battery because I found it on sale and I've been wanting to get one for a while. I'm a little concerned that the winter storm moving through might take out the heat in a day or two and I'll really get a chance to test this thing out, but I'm sure it will be okay because this is big enough to run a small heater for a little while. Or power the mini fridge for some meds. Or run the c-pap. We're so dependent on electricity, we don't even think of what we lose if the grid goes down. It just feels like a more important investment day by day. So far, it works great. It charges quickly from the wall. I haven't tried it with my solar panel yet. It's not a Jackery brand panel, so I hope that's not a problem, but I don't think it should be. I'll be waiting until it's warmer to try that, unless the power does go out! If that happens in a few days, I'll let you know how that goes!"
review47,"The power goes out in my neighborhood more often than I'd like. I decided to buy this Jackery backup battery to keep my fridge running, for the most part. Since I bought it the power stopped going out so I appreciated the power of the Jackery right there. But yesterday the power went out for hours and I used it as I had planned. When I first started using it it was charged to 93% then throughout the day I ran my large refrigerator for 4 hours, charged my iPad, charged an auxillary battery and made some toast in the toaster and by the time the lights came back on the battery was at 43%. Oh and I used the flashlight while I was in the kitchen. I was really hoping that it would keep my frozen foods frozen and it did so much more than that."
review48,I had an issue and customer service took care of it.Great customer service and a great product.I highly recommend!
review49,"The Jackery Explorer 1000 is a versatile and powerful portable power station that’s perfect for camping trips, outdoor adventures, or even as an emergency backup power source. It can power a variety of devices, including laptops, mini-fridges, CPAP machines, and more. The 1000W pure sine wave inverter provides a stable power output, making it safe for sensitive electronics. The build quality is solid, with a robust and durable design. The LCD screen is a nice touch, providing real-time information about remaining battery life, input/output wattage, and charging status."
review50,We lose power at our home about 5 x a year. Usually out from 5-24 hours. The Jackery has been a valuable item to have charged and ready. Got 2! Highly recommend critical review:
review51,"I barely got three uses out of the Explorer 1000 before it completely broke down despite all efforts with troubleshooting. I had purchased the 1000 model on 2020. It is now 2024. It was mainly for power outages at home and periodic outdoor trips. For comparison, I had also previously purchased 300 and 500 models and both continue to work very well despite having been purchased earlier. Jackery support team went through the typical support responses (eg. “Power stations are like car batteries and you should….” etc etc and “try resetting” etc and they could not give further support). To be fair, it was just one year beyond the warranty period so “that’s their policy on these matters”. Sigh. What I have learned: Their products are attractive and generally work well. Their products are popular. But Jackery’s product support is typical product support. Other company’s product support have gone above and beyond. Was hoping for additional information on alternatives to revive the power station (try sending to third party to repair etc etc) After all, I had only used it three times and paying $990 for it! Wonder if others have had slightly better support during the warranty period? Oh well…… Updated review 06 Feb 25: After this review, I was contacted by phone and email about the issue. Kudos to them for that. Jackery said that I could send it to them with postage paid by them and they will re-evaluate it for repair and if possible fix it for a price. Sounds reasonable. Later Jackery indicated I need to pay for postage as well! Obviously, the cost of paying the postage, AND the repair (if fixable) was not worth it. Additionally, I was on vacation during the communications and Jackery seemed to be in a rush and keen to close the ticket. Pluses and minuses here; I’d say that their products are generally good but Jackery’s support, in my case , if needed, is like pulling teeth. I like to support a company with both good products AND customer support. I’ll try Anker or Ecoflow next."
review52,Product seems fine at least after just a week of ownership but this connector issue why do we have to have special connectors and junk up our drawer with all these different connections very disappointed… make one kind of connector and stick to it for charging your battery from a solar panel…. it’s proprietary that does no one any good So unless you wanna search search search for special connectors that fit your Jackery look elsewhere
review53:,"Just received my Jackery. While I haven't actually used it out in the wild yet I'm already highly disappointed. The box was sealed, but after taking the unit out I saw several scuffs on the top and front of the unit. One mark in front is deep and bad. So apparently they're repackaging returns and selling them as new. Not cool. I charged it to 50% right away, and the charging speed from my wall outlet was steadily and consistently about 240-245 watts. It never even hit 250 watts. The bluetooth kept disconnecting even though I was only about five feet away from the unit with my phone. I have no interest in or use for using wifi, but there's no way to disable it. Not that big of a deal, but the flashing icon is a bit annoying, and means it's constantly working to find a connection and connect. Not sure if this is a lemon (someone returned it after all) or if they're all like this, but it's definitely not what I was expecting. I already have an older 240 from a few years ago, and have had no issues with it. Unfortunately I lost the wall charger for that and only have the car charger. The wall charger from the 1000 v2 doesn't work with the 240, and the car charger from the 240 doesn't work with the 1000 v2. Overall quite frustrating and disappointing. UPDATE: the icing on the cake is that Jackery reached out to me two days after I posted this review and offered to make it right for me. I accepted their offer the same day, and now three days later they messaged me back, backtracking from the offer they extended to me, and is saying they're going to have a customer service representative contact me shortly. What? So my experience which was negative just became exponentially more negative based on their handling of a formerly satisfied and now dissatisfied customer."
review54:,The unit had potential for size and power but the solar option which is what most of us buy these products for is lacking. There are two ports for solar but its not clear which is one takes the larger amount of power or if its split in half and both combined allow for the 400w input. Also the cable you need or adapter is specific to Jackery and isn't a universal port you can just connect your normal solar cables for. The unit powered most things but NOT MY DRYER which doesn't even surge to 1600watt. the unit doesn't even attempt to start my dryer it just cuts off. For small appliances like coffee makers or fridges yeah it works but use case is limited and not universal. ALSO I could not get this to charge fast even with the app settings.
review55:,Good product but should come with storage bags for the money instead of buying separate
review56:,"Well, it can't even run a 200 Watt heater for more than 4 hours, a vacuum took it down to50 percent charge quickly. I'm disappointed about that, Because I wanted to use it in my small cabin out by the lake, so for that I don't think it's worth the $800. They're asking for it. It does charge up pretty quickly. Maybe within 8 or 9 hours. It's fully charged again, but it's not as useful as I thought it would be period I think if you're just using it to power a laptop or a few other accessories charging phones but to run appliances. Maybe a small coffee Maker a couple times but really it's not all that I'm not real happy with it, over priced for the limitations and not nearly as advertised."
review57:,It took me a long time to figure out that the proper connection between the solar panels and the generator is the straight connector and not the right angle one. Nowhere in the instructions was this made clear and only after watching on line video reviews of the product did I realize why I could not make the solar panels generate input into the generator.
review58:,"I bought this to run lights for my booth at craft shows. After reading and watching hundreds of positive reviews, I thought I had found the perfect answer to my prayers! I did the math to be sure it would be able to supply the right amount of power that I needed, so I was super excited to give it a try. The first day I used it, it only lasted 5 hours and 50 minutes. Most of my shows are a minimum of 8 hours a day. When I found out that I wasn't allowed to return it, I was highly disappointed that I had wasted my money."
review59:,"Though it looks EXACTLY the same as other models, the input is very slightly different. My Jackery 300 takes a 7.9mm input, this takes an 8mm input. The 7.9 will fit but doesn't charge. Why not just make them all the same? You have to read VERY deep into the literature to find this info. Other than that, works great and has a built in solar charger so you can plug panels directly into it (not through their own controller if they have one)."
